{"id":"snap_fa886e50b177f044","schemaVersion":"0.2.0","title":"Implement tamper-evident snapshot verification","type":"feature","summary":"Added configuration-defined verification profiles and suites, explicit run-suite lifecycle, durable run evidence, fail-closed snapshot aggregation, and visible UI provenance.","userVisibleChange":"Snapshots now distinguish EVE-executed required checks from agent-reported validation claims.","relationships":{"corrects":[],"supersedes":[],"reverts":[],"dependsOn":[],"related":[]},"risks":[],"timeline":[],"decisions":[],"validation":[{"command":"GOCACHE=/tmp/eve-go-cache go test ./...","status":"passed","provenance":"reported_by_agent"},{"command":"npm test (ui)","status":"passed","provenance":"reported_by_agent"},{"command":"npm run build (ui)","status":"passed","provenance":"reported_by_agent"}],"verification":{"status":"not_configured","integrity":"unconfigured"},"artifacts":[],"implementation":{"branch":"main","gitState":"1c0f6fa92cd623df54d7ae0d5c067473a06d5e38","baseCommit":"3d4296bd6983b665f2105471780a0791ac20a4e0","commits":["1c0f6fa92cd623df54d7ae0d5c067473a06d5e38"],"dirty":true},"createdAt":"2026-07-17T20:50:02Z"}
